Unnamed: 0,title,ingredients,directions,link,source,NER
1131242,Momofuku Crack Pie,"[""Cookie"", ""3 ounces all-purpose flour (2/3 cup plus 1 tablespoon)"", ""1/8 teaspoon baking powder, scant"", ""1/8 teaspoon baking soda, scant"", ""1/4 teaspoon salt"", ""1/2 cup softened butter (1 stick)"", ""2 1/2 ounces light brown sugar (1/3 cup)"", ""1 1/4 ounces white sugar (3 tablespoons)"", ""1 egg"", ""3 1/2 ounces rolled oats (scant 1 cup)"", ""Crust"", ""1/4 cup butter (1/2 stick)"", ""3/4 ounce light brown sugar (1 1/2 tablespoons)"", ""1/8 teaspoon salt"", ""Filling"", ""10 1/2 ounces white sugar (1 1/2 cups)"", ""7 ounces light brown sugar (1 cup less 3 1/2 tsp)"", ""1/4 teaspoon salt"", ""3/4 ounce powdered milk (1/3 cup plus 1 teaspoon)"", ""1 cup butter, melted (2 sticks)"", ""7/8 cup heavy cream (3/4 cup plus 2 tablespoons, scant)"", ""1 teaspoon vanilla extract"", ""8 egg yolks"", ""powdered sugar, for garnish""]","[""Preheat oven to 375\u00b0F."", ""In a large bowl, sift together flour, baking powder, baking soda and salt."", ""In a stand mixer with the paddle attachment (or a large mixing bowl with a hand-held electric mixer), beat together butter, brown sugar and white sugar until light and fluffy. Add egg and beat until combined."", ""With mixer running on low, add flour mixture in small increments until fully combined. Add oats and mix until combined."", ""Spread mixture into an unlined, ungreased 9x13 baking sheet. Bake in preheated oven 20 minutes until golden brown and set. Cool a few minutes in pan, then turn out onto a rack until cool to the touch. Lower the oven to 350\u00b0F while the cookie cools."", ""Crumble the cooled cookie into the workbowl of a food processor. Add butter, brown sugar and salt. Pulse until combined (a clump of the mixture should hold together when pinched together). Divide the mixture between 2 10\"" pie pans, pressing into an even, thin layer on the bottom and sides. (The top edge will be ragged.)."", ""In a large bowl, whisk together white sugar, brown sugar, salt and powdered milk. Add melted butter, cream and vanilla and whisk until smooth. Whisk in egg yolks one at a time. Be careful not to incorporate too much air."", ""Divide the filling evenly between the two pie crusts. Bake one pie at a time for 15 minutes, then reduce heat to 325\u00b0F for 10 minutes, until the filling is golden brown but still jiggly (like a pecan pie). Place pie pans on a rack to cool."", ""Refrigerate the pies until well-chilled; the filling will be gooey. Dust with powdered sugar before serving.""]",www.food.com/recipe/momofuku-crack-pie-415283,Gathered,"[""Cookie"", ""flour"", ""baking powder"", ""baking soda"", ""salt"", ""butter"", ""brown sugar"", ""white sugar"", ""egg"", ""rolled oats"", ""Crust"", ""butter"", ""light brown sugar"", ""salt"", ""Filling"", ""white sugar"", ""brown sugar"", ""salt"", ""powdered milk"", ""butter"", ""heavy cream"", ""vanilla"", ""egg yolks"", ""powdered sugar""]"
2156408,Kahlua Brownies,"[""1 12 lbs 60% cacao chocolate"", ""1 cup butter, cut into pieces and at room temperature"", ""6 eggs, room temperature"", ""2 cups sugar"", ""14 teaspoon salt"", ""1 tablespoon Kahlua"", ""14 teaspoon Kahlua"", ""14 teaspoon vanilla extract"", ""1 12 cups all-purpose flour""]","[""Lightly grease a 9 x 13: pan."", ""Preheat the oven to 350 degrees F."", ""In a double boiler or using a bowl over a pot of simmering water, melt the chocolate and butter together."", ""With an electric mixer, beat together the eggs, sugar and salt."", ""Add the chocolate mixture and the vanilla extract and Kahlua."", ""Mix until smooth."", ""Slowly sift in the flour."", ""Bake for 45 to 55 minutes or until a toothpick comes out clean."", ""Place on"", ""a wire rack to cool for thirty minutes.""]",www.food.com/recipe/kahlua-brownies-467832,Recipes1M,"[""chocolate"", ""butter"", ""eggs"", ""sugar"", ""salt"", ""Kahlua"", ""Kahlua"", ""vanilla"", ""flour""]"
1097442,Beef Fillet And Asparagus Salad,"[""1 lb filet of beef, whole"", ""1 pint red wine (use a good wine, don't spoil your dish with plonk)"", ""black pepper, course ground"", ""8 -10 asparagus spears"", ""butter lettuce"", ""2 ounces avocado dip"", ""2 ounces mayonnaise"", ""fresh herb (to garnish) (optional)"", ""nasturtium petals (to garnish) (optional)""]","[""Place fillet in a baking dish and pour wine over."", ""Sprinkle with pepper."", ""Bake at 350 degrees F for 40-45 minutes."", ""Cool."", ""Cook asparagus until tender."", ""Refresh with cold water."", ""Arrange lettuce leaves on a large round platter."", ""Slice fillet thinly and roll each slice around an asparagus spear."", ""Arrange on lettuce (like the spokes of a wheel)."", ""Mix dip and mayonnaise together and spoon over beef."", ""Garnish with fresh herbs and nasturtiums.""]",www.food.com/recipe/beef-fillet-and-asparagus-salad-289327,Gathered,"[""filet of beef"", ""red wine"", ""black pepper"", ""butter"", ""avocado"", ""mayonnaise"", ""fresh herb"", ""petals""]"
649202,"""Quick"" Cajun Rice Dressing","[""2 pkg. Cajun rice (Lipton brand)"", ""1 bell pepper"", ""1 onion (small)"", ""1 (2 lb.) pkg. ground chuck"", ""1 tsp. red pepper (optional)""]","[""Cook ground meat in skillet with chopped onion and bell pepper."", ""Drain, then add 2 packages Cajun rice (Lipton brand). Follow directions on package."", ""Put in large casserole dish and bake for 20 minutes."", ""Then serve.""]",www.cookbooks.com/Recipe-Details.aspx?id=967177,Gathered,"[""Cajun rice"", ""bell pepper"", ""onion"", ""ground chuck"", ""red pepper""]"
233918,Poppy Seed Bread,"[""1 box yellow cake mix"", ""1 pkg. coconut instant pudding mix"", ""1/4 c. poppy seed"", ""4 eggs"", ""1/2 c. salad oil""]","[""Mix all ingredients together."", ""Pour into 2 greased bread pans. Bake at 350\u00b0"", ""for 30 to 40 minutes.""]",www.cookbooks.com/Recipe-Details.aspx?id=317101,Gathered,"[""yellow cake mix"", ""coconut instant pudding"", ""poppy seed"", ""eggs"", ""salad oil""]"
52994,Snack Cookies,"[""1 c. shortening"", ""1 c. granulated sugar"", ""1 c. brown sugar"", ""5 Tbsp. water"", ""2 eggs"", ""1 tsp. vanilla"", ""2 c. flour"", ""1 tsp. baking soda"", ""1/2 tsp. baking powder"", ""pinch of salt"", ""1 c. coconut"", ""2 c. crisp rice cereal"", ""2 c. quick oatmeal""]","[""Cream shortening, sugar and brown sugar."", ""Add eggs, one at a time."", ""Mix in water and vanilla."", ""Add dry ingredients and mix well, then stir in cereals."", ""Form small balls and press down on cookie sheet."", ""Bake at 350\u00b0 for 7 minutes."", ""Yields 6 to 7 dozen cookies."", ""These chewy cookies are delicious with a glass of cold milk.""]",www.cookbooks.com/Recipe-Details.aspx?id=478895,Gathered,"[""shortening"", ""sugar"", ""brown sugar"", ""water"", ""eggs"", ""vanilla"", ""flour"", ""baking soda"", ""baking powder"", ""salt"", ""coconut"", ""crisp rice cereal"", ""oatmeal""]"
1331129,Homemade Italian Tomato Sauce ,"[""Blend:"", ""2 qts. Solid Pack Red Tomatoes (Italian Plum tomatoes are best)"", ""Put into a kettle and add:"", ""1 lg. onion, sliced fine"", ""2 Tbs. honey"", ""2 Tbs. oil"", ""1 Tbs. salt (to taste)"", ""4 Tbs. dried sweet basil (or fresh leaves)"", ""1-2 cloves fresh garlic (optional)""]","[""Bring to a boil. Reduce heat and simmer 20-35 minutes."", ""The sauce will be quite thick if the right tomatoes are used. If the tomatoes are not too meaty - add some tomato puree. When using fresh tomatoes - press through colander. Let stand awhile then pour off the liquid that comes to the top. Save for soups. Use the thicker pulp that settles to the bottom to make the best sauce. The same can be done with home-canned tomatoes."", ""Sweet basil is the secret in making a flavorful sauce - so be generous with it."", ""For variation - a dash of oregano can be added. This is the herb that is used in making pizza."", ""When you have an extra thick sauce - add a little vegetable water (the liquid left from cooking artichokes) for a delicious flavor."", ""Italian Tomato Sauce can be made in quantity and sealed in sterile jars to be used later on spaghetti, noodles, pizza, lasagne, whole wheat ravioli, eggplant, stuffed peppers, artichokes, brown rice and other dishes.""]",www.epicurious.com/recipes/member/views/homemade-italian-tomato-sauce-1268058,Gathered,"[""Red Tomatoes"", ""onion"", ""honey"", ""oil"", ""salt"", ""sweet basil"", ""garlic""]"
59609,Rice Pudding,"[""1 cup rice"", ""1/2 cup sugar"", ""2 tsp. cornstarch"", ""1/2 tsp. salt"", ""2 2/3 cups whole milk"", ""2 strips lemon zest"", ""2 Tbsp. butter"", ""1 tsp. vanilla extract"", ""4 egg yolks"", ""1/2 tsp. ground cinnamon""]","[""Bring 1 1/2 cups cold water to boil in a medium heavy-bottomed saucepan over high heat."", ""Stir in rice, reduce heat to low, cover and cook until water has been absorbed and rice is tender, 20-25 minutes.""]",www.cookbooks.com/Recipe-Details.aspx?id=121074,Gathered,"[""rice"", ""sugar"", ""cornstarch"", ""salt"", ""milk"", ""lemon zest"", ""butter"", ""vanilla extract"", ""egg yolks"", ""ground cinnamon""]"
122348,Microwave Peanut Brittle,"[""1 c. raw peanuts"", ""1 c. sugar"", ""1/8 tsp. salt"", ""1/2 c. white syrup"", ""2 Tbsp. butter (not margarine)"", ""1 tsp. vanilla"", ""1 tsp. soda""]","[""Mix peanuts, sugar, salt and syrup in a deep bowl with a handle; cook on High 4 minutes."", ""Stir and cook 3 minutes longer. Add butter and vanilla; cook 2 minutes."", ""Add soda; stir."", ""Pour onto buttered cookie sheet."", ""Let cool; then break into small portions.""]",www.cookbooks.com/Recipe-Details.aspx?id=849409,Gathered,"[""peanuts"", ""sugar"", ""salt"", ""white syrup"", ""butter"", ""vanilla"", ""soda""]"
489330,Hattie'S Lemon Cake,"[""4 egg yolks"", ""4 egg whites"", ""1 c. whipping cream"", ""1/4 c. butter"", ""1 c. water"", ""1 pkg. lemon Jell-O"", ""1 c. sugar"", ""24 graham crackers""]","[""Add 1/2 cup sugar to egg yolks, 1/2 cup water and lemon juice and cook over slow fire."", ""While hot, add Jell-O and 1/2 cup water; cool."", ""Beat cream and 1/4 cup sugar."", ""Fold into mixture."", ""Beat egg whites and add 1/4 cup sugar; fold into mixture.""]",www.cookbooks.com/Recipe-Details.aspx?id=560860,Gathered,"[""egg yolks"", ""egg whites"", ""whipping cream"", ""butter"", ""water"", ""lemon Jell-O"", ""sugar"", ""crackers""]"
221062,Pineapple Fudge,"[""1 c. canned milk"", ""2 c. sugar"", ""2 Tbsp. butter"", ""1 c. crushed pineapple"", ""2 tsp. lemon juice""]","[""Combine milk, sugar and butter."", ""Boil and add pineapple."", ""Cook about 25 minutes, stirring constantly to prevent scorching."", ""Cool; add lemon juice and beat until sugar begins."", ""Pour into tins and make squares.""]",www.cookbooks.com/Recipe-Details.aspx?id=766483,Gathered,"[""milk"", ""sugar"", ""butter"", ""pineapple"", ""lemon juice""]"
1169257,Pilaf Stuffing With Dates And Pistachios,"[""2 1/2 cups basmati rice or 2 1/2 cups texmati rice"", ""5 - 5 1/2 cups turkey broth or 5 -5 1/2 cups chicken broth, as needed"", ""1 teaspoon salt"", ""4 tablespoons unsalted butter"", ""6 scallions, chopped"", ""3/4 cup chopped dates"", ""3/4 cup chopped toasted pistachio nut"", ""1 teaspoon ground cumin"", ""1/2 teaspoon dried oregano"", ""1/4 teaspoon ground cinnamon"", ""1/4 teaspoon fresh ground black pepper"", ""1/2 cup chopped fresh parsley""]","[""In a large saucepan, bring the rice, 5 cups broth, and salt to a boil over high heat."", ""Decrease heat to low and cover; simmer until the rice is tender and the liquid is absorbed, about 15 minutes."", ""Remove pan from heat and let stand for 5 minutes; transfer to a big bowl."", ""In a skillet, melt butter over medium heat; add in scallions; cook/stir until softened, 2-3 minutes."", ""Add in dates, pistachios, cumin, oregano, and pepper; stir until very fragrant, about 30 seconds."", ""Stir the scallion mixture and parsley into the rice; season with more salt, if needed."", ""Transfer to greased casserole; cover with foil and bake in preheated 350\u00b0 oven for 30 minutes.""]",www.food.com/recipe/pilaf-stuffing-with-dates-and-pistachios-372164,Gathered,"[""basmati rice"", ""turkey broth"", ""salt"", ""unsalted butter"", ""scallions"", ""dates"", ""pistachio nut"", ""ground cumin"", ""oregano"", ""ground cinnamon"", ""fresh ground black pepper"", ""parsley""]"
296937,Company Ham Dish,"[""1 (8 oz.) can pineapple chunks"", ""1/2 c. mayonnaise"", ""1 tsp. mustard"", ""1 tsp. salt"", ""1/4 tsp. black pepper"", ""1/2 c. chopped onion"", ""2 c. cooked ham"", ""1 c. chopped green pepper"", ""1/2 c. grated Swiss cheese"", ""3 c. cooked rice""]","[""Drain pineapple; reserve liquid."", ""Cut chunks in half."", ""Blend mayonnaise, mustard, seasoning and pineapple juice."", ""Stir in pineapple and remaining ingredients."", ""Serve cold as a salad or bake in casserole dish at 350\u00b0 for 30 minutes."", ""Sprinkle with paprika or almonds."", ""Makes 6 servings.""]",www.cookbooks.com/Recipe-Details.aspx?id=560049,Gathered,"[""pineapple"", ""mayonnaise"", ""mustard"", ""salt"", ""black pepper"", ""onion"", ""ham"", ""green pepper"", ""Swiss cheese"", ""rice""]"
163222,Potato Salad,"[""12 hard-boiled eggs"", ""12 medium potatoes (4 lb.), peeled, cooked and diced"", ""1/2 c. milk"", ""1 Tbsp. prepared mustard"", ""2 to 3 tsp. salt"", ""1/4 tsp. pepper"", ""1 large onion, quartered"", ""3/4 c. mayonnaise"", ""3 Tbsp. vinegar"", ""1/4 c. chopped parsley""]","[""Chop 10 eggs and combine with potatoes in a large bowl. Combine milk, mustard, salt, pepper and onion in container of blender; whirl until onion is finely chopped."", ""Add mayonnaise and vinegar and whirl just to blend."", ""Pour over egg-potato mixture and mix well."", ""Cover and refrigerate until chilled."", ""When ready to serve, slice remaining eggs; sprinkle salad with parsley."", ""Garnish with egg slices."", ""Sprinkle with paprika, if desired.""]",www.cookbooks.com/Recipe-Details.aspx?id=543854,Gathered,"[""eggs"", ""potatoes"", ""milk"", ""mustard"", ""salt"", ""pepper"", ""onion"", ""mayonnaise"", ""vinegar"", ""parsley""]"
908965,Fabulous Chocolate Chip Cookies,"[""2 1/2 cups all-purpose flour"", ""1 teaspoon baking soda"", ""1/4 teaspoon salt"", ""1/2 cup white sugar"", ""1 cup packed brown sugar"", ""1/2 cup butter"", ""2 eggs"", ""2 teaspoons vanilla extract"", ""1/2 cup semisweet chocolate chips"", ""1/3 cup candy-coated chocolate pieces"", ""1/3 cup peanut butter chips"", ""2 teaspoons honey"", ""1 pinch ground cinnamon"", ""1/4 cup chopped walnuts""]","[""Preheat oven to 300 degrees F (150 degrees C). Sift together the flour, baking soda, salt and cinnamon, set aside."", ""In a medium bowl, cream together the butter, brown sugar and white sugar. Beat in the eggs, vanilla and honey. Stir in the dry ingredients, then fold in the chocolate chips, chocolate candies, peanut butter chips and nuts. Drop dough by teaspoons onto an unprepared cookie sheet."", ""Bake for 15 to 18 minutes in the preheated oven, until the cookies are golden around the edges. Remove from the baking sheet to cool on wire racks.""]",www.allrecipes.com/recipe/15318/fabulous-chocolate-chip-cookies/,Gathered,"[""flour"", ""baking soda"", ""salt"", ""white sugar"", ""brown sugar"", ""butter"", ""eggs"", ""vanilla"", ""chocolate chips"", ""candy-coated chocolate"", ""peanut butter"", ""honey"", ""ground cinnamon"", ""walnuts""]"
254669,4 Layer Dessert,"[""1 stick margarine"", ""1 c. all-purpose flour"", ""2 c. chopped pecans"", ""8 oz. pkg. cream cheese"", ""1 c. confectioners sugar"", ""16 oz. Cool Whip"", ""3 c. milk"", ""3 small pkg. butterscotch or chocolate instant pudding mix""]","[""Mix margarine, flour and 1 1/2 cups pecans together."", ""Press in bottom of a 2-quart baking dish."", ""Bake at 375\u00b0 for 7 to 10 minutes. Mix cream cheese, confectioners sugar and 3/4 of Cool Whip."", ""Spread over cooled crust."", ""Mix the milk and pudding mix together."", ""Spread over the cream cheese layer."", ""Top with Cool Whip and sprinkle with nuts.""]",www.cookbooks.com/Recipe-Details.aspx?id=487261,Gathered,"[""margarine"", ""flour"", ""pecans"", ""cream cheese"", ""confectioners sugar"", ""milk"", ""butterscotch""]"
1185682,Baby Roasted Deviled Potatoes,"[""3 lbs small baby red potatoes, peeled"", ""4 tablespoons oil"", ""2 teaspoons salt"", ""black pepper (optional)"", ""1/4 cup butter"", ""2 teaspoons cider vinegar"", ""1 teaspoon Dijon mustard"", ""1/4 teaspoon cayenne pepper (can use more or less)""]","[""Wash the potatoes well under cold water; dry the skins."", ""Set oven to 425 degrees."", ""Place a large baking sheet that has been lightly sprayed with non-stick cooking spray or buttered in the oven to preheat for 10 minutes."", ""If using large potatoes, quarter them."", ""Toss the potatoes with oil, 1 teaspoon salt and a small amount of black pepper if desired."", ""Carefully remove the hot pan from the oven, and spread the potatoes, cut side down if using sliced potatoes."", ""Roast for about 12-14 minutes until undersides are golden."", ""Turn the potatoes and roast until tender (about another 12-15 minutes more)."", ""While the potatoes are roasting, melt butter in a small saucepan (can melt in the microwave)."", ""Whisk in vingear, mustard, cayenne pepper and 1 teaspoon salt."", ""Transfer the roasted potatoes to a large bowl, then toss with the butter mixture with HOT potatoes until well coated."", ""Delicious!""]",www.food.com/recipe/baby-roasted-deviled-potatoes-146267,Gathered,"[""baby red potatoes"", ""oil"", ""salt"", ""black pepper"", ""butter"", ""cider vinegar"", ""mustard"", ""cayenne pepper""]"
1283112,Easy Pancakes ,"[""3 Cups Flour"", ""3 Cups Milk"", ""3 Eggs"", ""3 Tbsp Baking Powder"", ""1 tsp Salt"", ""1 tsp vanilla (optional)""]","[""Mix all ingredients in a large mixing bowl. Cook on griddle at 350\u00b0 until well browned."", ""For buttermilk pancakes - omit 3 Cups of milk and 3 Tbsp baking powder and add 3 Cups buttermilk and 1 1/2 tsp soda""]",www.epicurious.com/recipes/member/views/easy-pancakes-50175219,Gathered,"[""Flour"", ""Milk"", ""Eggs"", ""Baking Powder"", ""Salt"", ""vanilla""]"
974006,Tomato Spinach Cream Cheese Lasagna,"[""For the tomato sauce"", ""1 tablespoon oil"", ""3 medium sized carrots, chopped"", ""2 medium onions, chopped"", ""2 garlic cloves, minced"", ""680 g passata (you can also use your fav pasta sauce and omit seasonings)"", ""1/4 teaspoon fresh ground black pepper"", ""1/4 teaspoon sage, dried"", ""1/8 teaspoon chili powder"", ""1/2 bunch parsley, chopped"", ""For the white sauce"", ""2 tablespoons oil"", ""2 tablespoons flour"", ""500 ml milk, warmed (as a vegan use non-dairy)"", ""1/4 teaspoon fresh ground black pepper"", ""1 laurel leaf, dried"", ""1/4 teaspoon sage, dried"", ""For the spinach cream cheese layer"", ""250 g frozen chopped spinach, defrosted and drained"", ""200 g cream cheese (low-fat is fine, as a vegan use a vegan brand)"", ""1/4 teaspoon garlic powder"", ""1/4 teaspoon black pepper, freshly ground"", ""1/8 teaspoon nutmeg"", ""2 tablespoons blue cheese, crumbled (as a vegan opt out of this)"", ""1 teaspoon psyllium, husk ground (or use flax seeds)"", ""For assembly"", ""8 sheets whole wheat lasagna noodles"", ""1 cup cheese, grated (use your favourite, as a vegan opt out of or use soy)""]","[""For the tomato sauce heat the oil in a large frying pan. When it's hot, add the chopped vegetables and the garlic. Sautee until lightly browned (about 5 minutes)."", ""Then add the passata or pasta sauce and seasonings if using. Simmer for 10 minutes, then set aside."", ""For the white sauce heat the oil in a pot. When it's hot, add the flour stirring vigorously using a wire whisk for about 2 minutes or until flour is nicely browned."", ""Add a small portion of the warm milk and stir to combine. Add the remaining milk little by little stirring after each addition."", ""Season, reduce the heat to medium-low and simmer for about 10 minutes or until thickened. Set aside."", ""For the cream cheese spinach layer combine all ingredients in a large bowl."", ""When your're ready to assemble the lasagna spread a bit of the tomato sauce in a large casserole dish (mine holds about 5 l/5 quarts). Top with two lasagna sheets and then half of the remaining tomato sauce. Top with another 2 sheets of lasagna and then the remaining half of the tomato sauce."", ""Then add another 2 sheets of lasagna and on top of that the spinach cream cheese spread."", ""Cover with another 2 lasagna sheets, pour over white sauce and top with grated cheese (if using)."", ""Place in the preheated oven and bake at 180\u00b0C/350\u00b0F for about 30 minutes or until bubbly and nicely browned (you might need to cover it after 20 minutes if it gets too brown)."", ""Remove from the oven and allow to set up for 20 minutes before cutting."", ""Enjoy!""]",www.food.com/recipe/tomato-spinach-cream-cheese-lasagna-474440,Gathered,"[""tomato sauce"", ""oil"", ""carrots"", ""onions"", ""garlic"", ""passata"", ""fresh ground black pepper"", ""sage"", ""chili powder"", ""parsley"", ""white sauce"", ""oil"", ""flour"", ""fresh ground black pepper"", ""laurel leaf"", ""sage"", ""cream cheese"", ""spinach"", ""cream cheese"", ""garlic"", ""black pepper"", ""nutmeg"", ""blue cheese"", ""psyllium"", ""whole wheat lasagna noodles"", ""cheese""]"
477430,Fried Cheese,"[""1 lb. Kasseri cheese, sliced lengthwise in 1/4-inch thick wedges"", ""2 egg yolks, minced with 2 Tbsp. water"", ""flour"", ""olive oil"", ""2 lemons, cut in quarters""]","[""Dip cheese slices into egg yolk mixture, then into flour, coating each side evenly."", ""Shake off excess flour.""]",www.cookbooks.com/Recipe-Details.aspx?id=443896,Gathered,"[""Kasseri cheese"", ""egg yolks"", ""flour"", ""olive oil"", ""lemons""]"
1578708,Baked Pears,"[""2 whole Large Pears"", ""6 Tablespoons Unsalted Butter, melted"", ""1/4 cups Packed Brown Sugar"", ""1/3 cups Dried Berries"", ""1/3 cups Slivered Almonds"", ""1 Tablespoon Vanilla"", ""3 Tablespoons Quick Cooking Rolled Oats"", ""1/2 teaspoons Ground Cinnamon"", ""Fleur De Sel Caramel Sauce, To Drizzle""]","[""Preheat the oven to 375\u00b0F. Slice each pear in half and remove the core. Place the pears cut side up on a baking sheet. Mix the remaining ingredients (except the caramel sauce) together in a bowl. Fill each pear with the granola mixture. Bake for about 30 minutes. Remove from the oven. Heat the caramel sauce in the microwave and drizzle with the fleur de sel caramel sauce.""]",tastykitchen.com/recipes/desserts/baked-pears/,Gathered,"[""Unsalted Butter"", ""\u00bc"", ""Berries"", ""Vanilla"", ""Quick Cooking Rolled Oats"", ""Ground Cinnamon"", ""Fleur De Sel Caramel Sauce""]"
460033,Shrimp Gumbo,"[""1 bag crab boil"", ""1 c. flour"", ""4 qt. water"", ""3 c. chopped onion"", ""1 c. chopped celery"", ""1 c. chopped green onions"", ""3 lb. fresh shrimp, peeled and deveined"", ""5 garlic cloves, chopped"", ""1 c. chopped bell pepper"", ""1 can Ro-Tel tomatoes"", ""1 (8 oz.) can tomato sauce"", ""1/4 c. fresh parsley, chopped"", ""seasoning salt"", ""red and black pepper"", ""gumbo file"", ""2 bay leaves""]","[""Brown flour in oil until copper color. Add 1 cup onions. Add to water a bag of crab boil and let come to a boil. Remove bag and add roux, bay leaves, remaining onions, celery, garlic and bell pepper. Let simmer for 1 hour. Then add Ro-Tel tomatoes, tomato sauce and seasonings. Let simmer another 30 minutes. Add shrimp, green onions and parsley. Let boil until shrimp are cooked, about 3 to 5 minutes. Add 1 tablespoon file. Remove bay leaves. Serve over rice.""]",www.cookbooks.com/Recipe-Details.aspx?id=112735,Gathered,"[""crab boil"", ""flour"", ""water"", ""onion"", ""celery"", ""green onions"", ""fresh shrimp"", ""garlic"", ""bell pepper"", ""Ro-Tel tomatoes"", ""tomato sauce"", ""fresh parsley"", ""salt"", ""red"", ""gumbo file"", ""bay leaves""]"
264797,Zucchini Bread,"[""2 c. zucchini"", ""2 c. sugar"", ""3 eggs"", ""1 c. oil"", ""3 c. flour"", ""1 tsp. vanilla"", ""1 tsp. baking soda"", ""1/2 tsp. baking powder"", ""1 tsp. salt"", ""1 tsp. cinnamon"", ""1 c. raisins, steam and let cool 1 hour"", ""1 (20 oz.) can pineapple""]","[""Beat sugar, eggs and oil until fluffy."", ""Add flour, vanilla, baking soda, baking powder, salt and cinnamon."", ""Stir in zucchini and raisins."", ""Fill half a loaf pan."", ""Bake at 325\u00b0 for 45 minutes to 1 hour."", ""Makes 2 or 3 pans.""]",www.cookbooks.com/Recipe-Details.aspx?id=451108,Gathered,"[""zucchini"", ""sugar"", ""eggs"", ""oil"", ""flour"", ""vanilla"", ""baking soda"", ""baking powder"", ""salt"", ""cinnamon"", ""raisins"", ""pineapple""]"
1139702,Quick & Easy Spinach And Feta Phyllo Pie,"[""2 (10 ounce) packages frozen chopped spinach, thawed,drained and squeezed dry"", ""3 -4 green onions, chopped"", ""4 eggs, lightly beaten"", ""1/2 cup nonfat cottage cheese"", ""4 ounces feta cheese, crumbled or chopped"", ""1/2 teaspoon salt"", ""1/4 teaspoon black pepper"", ""1/4 teaspoon nutmeg"", ""1 teaspoon dried dill"", ""10 sheets phyllo dough, thawed"", ""butter-flavored cooking spray""]","[""Preheat oven to 350\u00b0F Spray an 8x8 glass baking dish with the cooking spray."", ""In a medium bowl, stir together everything except the phyllo."", ""Lay one sheet of phyllo in the baking dish, allowing the edges to hang over the sides of the dish."", ""Spray with cooking spray."", ""Repeat with 4 more sheets of phyllo, spraying and alternating the direction of each sheet."", ""Spoon spinach mixture on top of the prepared phyllo in the pan."", ""Spray and layer remaining 5 sheets just the same as you did before."", ""Roll edges of dough to form a rim."", ""Spray the top."", ""Bake for 35-45 minutes or until golden brown."", ""Let stand 5-15 minutes before cutting and serving.""]",www.food.com/recipe/quick-easy-spinach-and-feta-phyllo-pie-109499,Gathered,"[""eggs"", ""cheese"", ""feta cheese"", ""salt"", ""black pepper"", ""nutmeg"", ""dill"", ""phyllo"", ""butter""]"
