Unnamed: 0,title,ingredients,directions,link,source,NER
1505387,Chinese Takeout-On-A-Stick,"[""3 tablespoons reduced-sodium soy sauce"", ""3 tablespoons sesame oil"", ""4 teaspoons brown sugar"", ""4 teaspoons minced fresh gingerroot"", ""2 garlic cloves, minced"", ""1/2 teaspoon crushed red pepper flakes"", ""1 pound boneless skinless chicken breasts, cut into 1-inch cubes"", ""3 cups fresh broccoli florets""]","[""In a large bowl, combine the first six ingredients; remove 3 tablespoons for basting. Add chicken to remaining soy sauce mixture; toss to coat. On four metal or soaked wooden skewers, alternately thread chicken and broccoli."", ""Place skewers on greased grill rack. Cook, covered, over medium heat or broil 4 in. from the heat until chicken is no longer pink, 10-15 minutes, turning occasionally. Baste with reserved soy mixture during the last 4 minutes of cooking.""]",www.tasteofhome.com/recipes/chinese-takeout-on-a-stick/,Gathered,"[""soy sauce"", ""sesame oil"", ""brown sugar"", ""fresh gingerroot"", ""garlic"", ""red pepper"", ""chicken breasts"", ""fresh broccoli florets""]"
558098,Chocolate Mint Pudding,"[""1/2 c. sugar"", ""1/3 c. unsweetened cocoa"", ""1/4 c. cornstarch"", ""3 c. 1% low-fat milk"", ""1 Tbsp. creme de menthe"", ""1 tsp. vanilla extract"", ""3 peppermint candy pieces, coarsely crushed""]","[""Combine first 3 ingredients in a medium saucepan."", ""Gradually add milk, stirring with a wire whisk until smooth."", ""Cook over medium-low heat, stirring constantly, 25 to 30 minutes or until mixture is thickened."", ""Remove from heat; stir in creme de menthe and vanilla."", ""Spoon mixture into individual dessert dishes."", ""Cover and chill thoroughly."", ""Just before serving, sprinkle evenly with crushed peppermint."", ""Makes about 7 servings.""]",www.cookbooks.com/Recipe-Details.aspx?id=742197,Gathered,"[""sugar"", ""unsweetened cocoa"", ""cornstarch"", ""milk"", ""creme"", ""vanilla extract"", ""peppermint""]"
2058062,Marshmallow Cocoa Bars Recipe,"[""2 c. sugar"", ""1 c. vegetable oil"", ""4 Large eggs"", ""1/3 c. unsweetened cocoa pwdr"", ""1 1/2 c. flour"", ""3 teaspoon vanilla"", ""1 jar marshmallow creme""]","[""Combine above ingredients (except marshmallows) in mixing bowl."", ""Pour into greased 13x9 inch pan."", ""Bake at 350 degrees for 30 min."", ""Cold 10 min and spread marshmallows on top."", ""Cold 20 min longer."", ""Icing: Mix butter with powdered sugar, evaporated lowfat milk, vanilla and dry cocoa pwdr."", ""Spread over marshmallow and allow to set (preferably in refrigerator)."", ""Makes 24 bars.""]",cookeatshare.com/recipes/marshmallow-cocoa-bars-6773,Recipes1M,"[""sugar"", ""vegetable oil"", ""eggs"", ""unsweetened cocoa"", ""flour"", ""vanilla"", ""marshmallow creme""]"
1323733,Citrus Shrimp Stir-Fry ,"[""1.25 lbs shrimp"", ""3/4 t salt"", ""1 T minced peeled fresh ginger"", ""1 T dark sesame oil"", ""5 cloves garlic, thinly sliced"", ""2 cups red or green bell pepper, cut into 1 inch pieces"", ""3 T dry sherry"", ""2 T rice vinegar"", ""1.5 cups orange sections (approx 2 large oranges)"", ""1 cup sliced green onions"", ""cilantro"", ""brown jasmine rice (make as package suggests)""]","[""1. Pat shrimp dry with paper towels. Place shrimp in bowl with salt and let stand 10 minutes."", ""2. Heat wok over medium-high heat. Add ginger, oil and garlic for approx 4 minutes or until it starts to brown. Add shrimp and cook another 1-2 minutes. Add peppers and cook another 2-3 minutes. Add sherry and vinegar; bring to simmer and cook 1 minute or until wine mixture is slightly syrupy. Add orange sections and stir gently."", ""3. Serve shrimp over rice and sprinkle with green onions and cilantro. Approx 1.5 cups of shrimp mixture, 0.5 cups rice.""]",www.epicurious.com/recipes/member/views/citrus-shrimp-stir-fry-52920281,Gathered,"[""shrimp"", ""salt"", ""T"", ""T"", ""garlic"", ""red"", ""T"", ""T rice vinegar"", ""orange sections"", ""green onions"", ""cilantro"", ""brown jasmine rice""]"
1556311,Chili Lime Potato Breakfast Burritos,"[""3 whole Potatoes (I Used 2 Russets And 1 Sweet Potato), Peeled And Diced"", ""3 Tablespoons Olive Oil"", ""1 teaspoon Salt"", ""1 teaspoon Garlic Powder"", ""1 Tablespoon Chili Powder"", ""2 Tablespoons Lime Juice"", ""6 whole Burrito Sized Tortillas""]","[""Preheat oven to 425\u00b0F. Put diced potatoes on a baking sheet and drizzle generously with olive oil. Sprinkle with salt, garlic powder, chili powder, and lime juice. Toss potatoes to coat evenly. Roast for about 15-20 minutes, or until tender and a little crispy."", ""Put in a burrito-sized tortilla and top with some eggs, cheese, and favorite salsa. These would be great with some sausage also, for those that need to put some meat in there!""]",tastykitchen.com/recipes/breakfastbrunch/eggs-breakfastbrunch/chili-lime-potato-breakfast-burritos/,Gathered,"[""Potatoes"", ""Olive Oil"", ""Salt"", ""Garlic"", ""Chili Powder"", ""Lime Juice"", ""Sized Tortillas""]"
302219,Crock-Pot Chicken,"[""1 (8 oz.) jar Armour dried beef"", ""2 cans cream of mushroom soup"", ""1 large container sour cream"", ""1/2 lb. bacon"", ""boneless breast of chicken""]","[""Alternately layer all ingredients in crock-pot and cook on low all day.""]",www.cookbooks.com/Recipe-Details.aspx?id=542020,Gathered,"[""beef"", ""cream of mushroom soup"", ""sour cream"", ""bacon"", ""boneless breast of chicken""]"
1901656,Cannonball Sandwich (Meat Recipe,"[""20 lb BEEF Grnd FZ"", ""8 x Large eggs SHELL"", ""1 3/8 lb TOMATO PASTE #2 1/2"", ""3/4 tsp GARLIC DEHY GRA"", ""8 lb TOMATOES # 10 CAN"", ""2 1/2 lb ONIONS DRY"", ""12 ounce ONIONS DRY"", ""2 1/4 lb BREAD SNDWICH 22OZ #51"", ""100 x BUN HAMBGR 13OZ #102"", ""2 ounce SUGAR, GRANULATED 10 LB"", ""1/2 ounce SALAD OIL, 1 GAL"", ""2 ounce SHORTENING, 3LB"", ""1 Tbsp. PEPPER BLACK 1 LB CN"", ""1 tsp PEPPER BLACK 1 LB CN"", ""3 x BAY LEAVES"", ""2 Tbsp. BASIL SWEET Grnd"", ""2 Tbsp. OREGANO Grnd"", ""3 ounce SALT TABLE 5LB"", ""1 ounce SALT TABLE 5LB""]","[""1."", ""PREPARE TOMATO SAUCE BY FOLLOWING STEPS 1 THROUGH 4 OF RECIPE NO."", ""RESERVE FOR USE IN STEP 5."", ""2."", ""PREPARE MEATBALLS BY FOLLOWING STEPS 4 THROUGH 7 OF RECIPE NO."", ""L-39000, COOKING MEATBALLS AN ADDITIONAL 10 Min."", ""KEEP MEATBALLS Warm FOR USE IN STEP 4."", ""3."", ""SLICE ROLLS IN HALF LENGTHWISE SO Which THE BOTTOM HALF IS THICKER THAN THE TOP HALF."", ""4."", ""PLACE 3 MEATBALLS ON BOTTOM HALF OF EACH ROLL."", ""5."", ""POUR 1/2 C. (1-NO."", ""B LADLE) SAUCE OVER MEATBALLS."", ""COVER WITH TOP HALF OF ROLL."", ""6."", ""SERVE Warm."", ""NOTE:"", ""1."", ""IN STEP 1, 3/4 RECIPE TOMATO SAUCE, RECIPE NO."", ""L-39, STEPS 1-4 BE USED FOR PIZZA SAUCE."", ""2."", ""IN STEP 3, 25 LB FRENCH BREAD MAY BE USED."", ""CUT BREAD LENGTHWISE SO BOTTOM HALF IS THICKER THAN TOP HALF."", ""CUT LOAVES CROSSWISE INTO EQUAL Pcs TO YIELD 100 PORTIONS."", ""3."", ""IN STEP 3, BREAD MAY BE HEATED FPR 10 Min IN 325 F. OVEN."", ""SERVING SIZE: 1 SANDWICH""]",cookeatshare.com/recipes/cannonball-sandwich-meat-99018,Recipes1M,"[""BEEF"", ""eggs SHELL"", ""TOMATO PASTE #"", ""GARLIC"", ""TOMATOES"", ""ONIONS"", ""ONIONS"", ""SUGAR"", ""SALAD OIL"", ""SHORTENING"", ""PEPPER"", ""BAY LEAVES"", ""SWEET"", ""OREGANO"", ""SALT"", ""SALT""]"
99557,Morning Glory Muffins,"[""3 c. basic muffin mix"", ""cinnamon"", ""nutmeg"", ""1/2 c. chopped apple"", ""1/2 c. raisins"", ""1/2 c. shredded carrot"", ""1/2 c. chopped nuts"", ""water (to mix)""]","[""Mix all ingredients together. Make sure it isn't too loose. Scoop into muffin tin and bake at 350\u00b0 approximately 15 to 18 minutes.""]",www.cookbooks.com/Recipe-Details.aspx?id=103197,Gathered,"[""mix"", ""cinnamon"", ""nutmeg"", ""apple"", ""raisins"", ""carrot"", ""nuts"", ""water""]"
476091,Layer Salad,"[""shredded lettuce"", ""1 c. carrots, shredded"", ""1 c. diced celery"", ""5 diced eggs"", ""1 pkg. frozen peas"", ""12 pieces broken bacon slices"", ""bell pepper to taste"", ""2 c. mayonnaise"", ""2 Tbsp. sugar"", ""2 c. shredded cheese""]","[""Layer all ingredients (except last 3) in an oblong pan and frost with mayonnaise mixed with sugar."", ""Top with shredded cheese. Vary ingredients."", ""Superb for taking to parties!""]",www.cookbooks.com/Recipe-Details.aspx?id=411179,Gathered,"[""shredded lettuce"", ""carrots"", ""celery"", ""eggs"", ""frozen peas"", ""bacon"", ""bell pepper"", ""mayonnaise"", ""sugar"", ""shredded cheese""]"
547833,Pop'S Ugly Apple Cake,"[""2 c. sugar"", ""2 c. all-purpose flour"", ""2 tsp. baking soda"", ""2 tsp. salt"", ""2 tsp. cinnamon"", ""4 c. apples, peeled and chopped"", ""1/2 c. raisins"", ""1 1/2 c. salad oil"", ""2 eggs"", ""2 tsp. vanilla""]","[""Combine all ingredients in a large bowl."", ""Mix well. Bake in a 9 x 13-inch pan for 1 1/2 hours at 325\u00b0. Add topping while hot and return to oven.""]",www.cookbooks.com/Recipe-Details.aspx?id=1016126,Gathered,"[""sugar"", ""flour"", ""baking soda"", ""salt"", ""cinnamon"", ""apples"", ""raisins"", ""salad oil"", ""eggs"", ""vanilla""]"
1102437,Remoulade Sauce,"[""1 cup mayonnaise"", ""2 tablespoons lemon juice (fresh, not from a bottle)"", ""1 pinch cayenne"", ""1 tablespoon chopped cornichons or 1 tablespoon sour dill pickle"", ""1 tablespoon chopped capers"", ""1 tablespoon chopped fresh parsley"", ""1/2 teaspoon salt""]","[""Combine all together, serve."", ""Can add a drop or two of hot sauce for extra kick.""]",www.food.com/recipe/remoulade-sauce-73245,Gathered,"[""mayonnaise"", ""lemon juice"", ""cayenne"", ""cornichons"", ""capers"", ""parsley"", ""salt""]"
986440,Moist Fudgy Cocoa Brownies,"[""1 cup margarine"", ""1 cup baking cocoa"", ""2 cups sugar"", ""4 eggs"", ""2 teaspoons vanilla"", ""1 cup all-purpose flour"", ""1/4 teaspoon salt"", ""chopped nuts (optional)"", ""chocolate chips (optional)""]","[""Set oven on 350."", ""Coat 11 1/2 x 7 1/2 glass pan with margarine or butter (or slightly larger for thinner brownies*might have to adjust cooking time*)."", ""In a saucepan or glass bowl melt margarine."", ""Mix in by hand eggs and vanilla, then flour, salt, cocoa and sugar till moistened."", ""With mixer on low/med beat just till mixed."", ""Don't overbeat."", ""Fold in nuts and/or chocolate chips if desired."", ""Pour into prepared pan and level with spatula or spoon."", ""Bake 25-30 minutes, or test with toothpick."", ""I like mine gooey in the middle."", ""Cool and frost if desired."", ""(Try my Fluffy Butter Cocoa Frosting) Cut into desired servings.""]",www.food.com/recipe/moist-fudgy-cocoa-brownies-66986,Gathered,"[""margarine"", ""baking cocoa"", ""sugar"", ""eggs"", ""vanilla"", ""flour"", ""salt"", ""nuts"", ""chocolate chips""]"
1913511,Mashed Potatoes With Garlic Whistles and Olive Oil,"[""2 lbs russet potatoes"", ""1 12 teaspoons salt"", ""salt, to taste"", ""fresh ground black pepper"", ""14 cup extra virgin olive oil"", ""3 -4 garlic scapes, sliced (whistles)""]","[""Scrub the potatoes (peel if you wish) and add to a pot of cold, salted water."", ""Bring to a boil, partially covered, and cook for about 30 minutes, or until tender."", ""Drain the potatoes but *RESERVE* the cooking liquid."", ""Add the potatoes back to the pot and mash with a potato masher."", ""Turn on the heat to medium and whisk enough of the reserved cooking water with the potatoes to bring them to a thick, creamy consistency."", ""Do not overmix."", ""Season with salt and pepper to taste."", ""Heat up the olive oil either on the range or in the microwave just until warm."", ""Pour the olive oil on the potatoes and add the garlic whistles."", ""Stir to combine."", ""Serve hot.""]",www.food.com/recipe/mashed-potatoes-with-garlic-whistles-and-olive-oil-177525,Recipes1M,"[""potatoes"", ""salt"", ""salt"", ""fresh ground black pepper"", ""extra virgin olive oil"", ""garlic""]"
2006516,Bitter Cocoa Gnocchi: Gnocchi di Cacao,"[""3 pounds baking potatoes, like russets"", ""2 cups all-purpose flour"", ""1 egg, extra large"", ""1 pinch salt"", ""1/4 cut smoked ricotta salata, grated"", ""1 tablespoon bitter cocoa"", ""Pinch cinnamon"", ""2 tablespoons sugar"", ""Pinch salt"", ""1/4 cup candied citrus peel, chopped"", ""1/4 cup raisins, rehydrated"", ""1/2 cup butter, melted""]","[""Boil the whole potatoes until they are soft, about 45 minutes."", ""While still warm, peel the potatoes and pass them through vegetable mill onto clean pasta board."", ""Make a well in the center of the potatoes and sprinkle all over with the flour, using all the flour."", ""Place the egg and salt in the center of the well and using a fork, stir into flour and potatoes, just like making normal pasta."", ""Once the egg is mixed in, bring dough together, kneading gently until a ball is formed."", ""Knead gently another 4 minutes until ball is dry to the touch."", ""Divide the dough into 6 large balls."", ""Roll each ball into 3/4-inch diameter ropes and cut the ropes into 1-inch long pieces."", ""Flick the pieces off of a fork or along the concave side of a cheese grater to score the sides."", ""Drop the dough pieces into the boiling water and cook until they float to the surface, about 1 minute."", ""Meanwhile, in a medium bowl, combine the ricotta, cocoa, cinnamon, sugar, and a pinch of salt and stir well."", ""Drain the gnocchi and place them in the bowl with the cocoa mixture."", ""Toss to coat and remove from the bowl."", ""Place in a clean serving bowl with the citrus peel and raisins, drizzle with the melted butter and serve immediately.""]",www.foodnetwork.com/recipes/mario-batali/bitter-cocoa-gnocchi-gnocchi-di-cacao-recipe.html,Recipes1M,"[""baking potatoes"", ""flour"", ""egg"", ""salt"", ""ricotta salata"", ""bitter cocoa"", ""cinnamon"", ""sugar"", ""salt"", ""candied citrus peel"", ""raisins"", ""butter""]"
512216,Spinach Balls,"[""2 (10 oz. each) pkg. frozen chopped spinach, cooked according to pkg. directions and drained well"", ""2 c. one step chicken flavored stuffing mix"", ""1 c. grated Parmesan cheese"", ""6 large eggs, lightly beaten"", ""1 1/2 sticks butter or margarine (at room temperature)"", ""1/2 tsp. salt"", ""freshly ground pepper to taste""]","[""Have ready a jelly roll pan or cookie sheet with sides."", ""Mix all ingredients in a large bowl until well blended."", ""Roll level tablespoon of the mixture into balls the size of walnuts (you should have 60) and arrange them on the pan close but not touching."", ""Freeze until hard, then pack in gallon size freezer storage bag.""]",www.cookbooks.com/Recipe-Details.aspx?id=468126,Gathered,"[""directions"", ""stuffing mix"", ""Parmesan cheese"", ""eggs"", ""butter"", ""salt"", ""freshly ground pepper""]"
584890,Chicken Casserole,"[""3 to 4 chicken breasts, boiled"", ""2 cans cream of chicken soup"", ""2 cans French-style green beans"", ""1 c. Hellmann's mayonnaise"", ""1/2 tsp. curry powder"", ""1 can sliced water chestnuts"", ""your choice cheese""]","[""Boil chicken breasts."", ""In a 12 x 10 x 2-inch casserole dish, cut up chicken in chunks."", ""Drain all cans with liquid in them. Pour all ingredients in dish and mix well."", ""Grate your choice of cheese over the top of casserole."", ""Preheat oven to 325\u00b0 and cook for 20 minutes."", ""Serve over rice (optional).""]",www.cookbooks.com/Recipe-Details.aspx?id=602477,Gathered,"[""chicken breasts"", ""cream of chicken soup"", ""green beans"", ""mayonnaise"", ""curry powder"", ""water chestnuts"", ""your choice cheese""]"
1079953,Blackened Country French Salmon Fillets,"[""1 1/2 lbs salmon fillets (2)"", ""1 (16 ounce) bottle of ken's country French dressing (lite)"", ""1 lemon, juiced"", ""garlic or garlic powder"", ""salt"", ""paprika"", ""capers (optional)""]","[""Mix all ingredients except for fish."", ""Lay the fillets, skin side down in baking pan."", ""Pour marinade over fish and allow to sit for ten minutes."", ""Bake for 10-15 minutes in 350 oven, basting regularly."", ""Move fish to just under the broiler and allow to blacken surface of fish for a few minutes."", ""Add capers if desired, baste again, and serve.""]",www.food.com/recipe/blackened-country-french-salmon-fillets-272971,Gathered,"[""salmon"", ""lemon"", ""garlic"", ""salt"", ""paprika"", ""capers""]"
444136,Chicken Curry,"[""2 chickens, cut into 8 pieces each"", ""4 garlic cloves"", ""3 large, spanish onions"", ""2 tsp. fresh grated ginger root (peeled)"", ""2 medium-sized ripe tomatoes, chopped"", ""2 large jalapeno peppers, sliced"", ""1 bunch cilantro, chopped"", ""1-1/2 tsp. salt"", ""1 tsp. paprika"", ""6 cloves"", ""2 large bay leaves"", ""1/2 tsp. turmeric"", ""4 cardamom"", ""3/4 vegetable oil"", ""4-5 cups water""]","[""Wash and drain chicken in colander."", ""Place the oil in a large cooking pot, preferably a heavy cast aluminium pot."", ""Peel and thinly slice the onions and garlic and place them in the oil that has been pre-heated at medium-high heat."", ""Cook these until golden brown, stirring occasionally.""]",www.cookbooks.com/Recipe-Details.aspx?id=7886,Gathered,"[""chickens"", ""garlic"", ""onions"", ""fresh grated ginger root"", ""tomatoes"", ""jalapeno peppers"", ""cilantro"", ""salt"", ""paprika"", ""cloves"", ""bay leaves"", ""turmeric"", ""cardamom"", ""vegetable oil"", ""water""]"
422205,Kindergarten Thanksgiving Soup,"[""6 c. beef broth"", ""1/4 c. potato, diced"", ""1/2 c. carrots, diced"", ""1/2 c. celery, diced"", ""2 Tbsp. onion, diced"", ""1/4 c. alphabet macaroni pasta""]","[""Bring beef broth to a boil in a soup pot. Add potatoes, carrots, celery and onion. Cover and simmer for 30 minutes. Add alphabet macaroni. Simmer 5 more minutes. Serves 6.""]",www.cookbooks.com/Recipe-Details.aspx?id=20763,Gathered,"[""beef broth"", ""potato"", ""carrots"", ""celery"", ""onion"", ""alphabet macaroni pasta""]"
1234361,Chicken And Cheddar Strata,"[""5 cups bread (cubed)"", ""1 1/2 cups cooked chicken (chopped)"", ""1 (10 ounce) package chopped frozen broccoli, thawed and drained"", ""2 cups cheddar cheese, shredded"", ""6 eggs"", ""3 cups milk"", ""1 small onion (chopped, diced)"", ""1/2 teaspoon salt"", ""1 teaspoon dry mustard""]","[""Butter a six cup, deep, straight sided baking dish. Layer 1/3 each of the bread, chicken, broccoli and cheese in the baking dish; repeat to make two more layers."", ""Beat eggs with milk, onion, salt and mustard until well blended."", ""Pour egg mixture over strata. Cover and refrigerate at least 3 hours or overnight."", ""Bake uncovered in a 350 deg. F oven for 1 1/4 hours or util puffy and golden.""]",www.food.com/recipe/chicken-and-cheddar-strata-143279,Gathered,"[""bread"", ""chicken"", ""frozen broccoli"", ""cheddar cheese"", ""eggs"", ""milk"", ""onion"", ""salt"", ""mustard""]"
765733,Strawberry Pie,"[""baked pie shell"", ""berries"", ""1 c. crushed berries"", ""3 Tbsp. cornstarch"", ""1/2 c. water"", ""1 c. sugar"", ""1 tsp. lemon juice""]","[""Slice berries in baked pie shell."", ""Mix sugar and cornstarch together; add to the crushed berries."", ""Boil until thick."", ""Add lemon juice and cool completely."", ""Pour over sliced berries.""]",www.cookbooks.com/Recipe-Details.aspx?id=888946,Gathered,"[""pie shell"", ""berries"", ""berries"", ""cornstarch"", ""water"", ""sugar"", ""lemon juice""]"
235515,Yvonne'S Cookies,"[""1 c. unsifted flour"", ""1/2 c. confectioners sugar"", ""1/2 c. cornstarch"", ""1/2 c. (1 stick) unsalted margarine"", ""1 tsp. vanilla or almond extract"", ""slivered almonds""]","[""Beat margarine until smooth."", ""Add remaining ingredients (except almonds); mix well."", ""You can knead this like a dough. Refrigerate 1 hour."", ""Shape into 1-inch balls."", ""Place 1 1/2-inches apart on ungreased cookie sheets."", ""Flatten slightly with a lightly floured fork."", ""Slide slivered almonds into the top of each cookie. Bake at 375\u00b0 for 10 to 12 minutes to barely light gold."", ""Makes about 30 cookies.""]",www.cookbooks.com/Recipe-Details.aspx?id=59714,Gathered,"[""flour"", ""confectioners sugar"", ""cornstarch"", ""unsalted margarine"", ""vanilla"", ""almonds""]"
1078453,Mancha Manteles - Mexican Tablecloth Stainer,"[""1/2 chicken, jointed"", ""225 g pork, cut into 2 . 5cm cubes"", ""1 tablespoon corn oil"", ""1 medium onion, chopped"", ""2 garlic cloves, crushed"", ""1 -2 chile, chopped"", ""350 g tomatoes, chopped"", ""25 g peanuts"", ""1 bay leaf"", ""1 teaspoon ground cinnamon"", ""1 -3 teaspoon chili powder"", ""3 whole cloves"", ""1 tablespoon sesame seeds"", ""1 tablespoon concentrated tomato puree"", ""1 green pepper, chopped"", ""1 plantain, cut into 2 . 5 cm slices"", ""1 pear, sliced"", ""1 cooking apple, sliced""]","[""Put the chicken and pork into a large pan, cover with water and simmer for 1 hours Drain and reserve the stock."", ""Heat the oil in a large pan and cook the onion, garlic and chillies until lightly browned."", ""Add tomatoes and continue to cook, uncovered, for 5 minutes."", ""Add peanuts, bay leaf, cinnamon, chilli powder, whole cloves and sesame seeds."", ""Simmer uncovered for 10 minutes."", ""Process mixture in an electric blender until smooth then return to the pan."", ""Add tomato puree, green pepper and the stock from the meat until the sauce is the consistency you prefer."", ""Add the chicken, pork, plantain, pear and apple."", ""Simmer for 10 minutes then serve.""]",www.food.com/recipe/mancha-manteles-mexican-tablecloth-stainer-390754,Gathered,"[""chicken"", ""pork"", ""corn oil"", ""onion"", ""garlic"", ""chile"", ""tomatoes"", ""peanuts"", ""bay leaf"", ""ground cinnamon"", ""chili powder"", ""cloves"", ""sesame seeds"", ""tomato puree"", ""green pepper"", ""plantain"", ""pear"", ""cooking apple""]"
1214267,Chicken Jalfrezi,"[""2 garlic cloves, finely chopped"", ""750 g chicken thigh fillets"", ""1/4 teaspoon turmeric powder"", ""1 onion, finely chopped"", ""1 teaspoon red chili powder"", ""1 teaspoon salt"", ""500 g tomatoes, finely chopped"", ""1/4 tablespoon oil"", ""1 teaspoon ground cumin"", ""1 teaspoon ground coriander"", ""2 tablespoons grated ginger"", ""2 tablespoons fresh coriander, chopped""]","[""heat 2 tbsp oil in a medium pot and fry onion and garlic for a few minutes on high heat (be careful not to burn onion)."", ""add the chicken, turmeric, chili powder and salt."", ""fry over medium low heat for 5-10 minutes, or until golden brown, scraping the base of the pan frequently and turning the chicken."", ""add tomatos, cover and cook over medium heat for 20 minutes."", ""uncover and simmer for 10 minutes so that excess liquid evaporates and the sauce thickens."", ""add cumin, ground coriander, ginger and fresh coriander and simmer for 5-7 minutes."", ""serve hot with plain rice, pitas or naan bread.""]",www.food.com/recipe/chicken-jalfrezi-190773,Gathered,"[""garlic"", ""chicken thigh"", ""turmeric powder"", ""onion"", ""red chili powder"", ""salt"", ""oil"", ""ground cumin"", ""ground coriander"", ""ginger"", ""fresh coriander""]"
2119438,Mediterranean Marinated Vegetable Salad,"[""2 large tomatoes, cut into wedges"", ""1 each green and yellow pepper, coarsely chopped Target 1 pkg For $2.99 thru 02/06"", ""1 zucchini, cut lengthwise in half, then sliced crosswise"", ""1/4 cup thin red onion slices"", ""1/2 cup Kraft Zesty Italian Dressing"", ""2 Tbsp. chopped fresh basil"", ""2 cloves garlic, minced"", ""1 cup Cracker Barrel Shredded 4 Cheese Italiano Cheese""]","[""Combine vegetables in large bowl."", ""Whisk dressing, basil and garlic until blended."", ""Add to vegetables; toss to coat."", ""Add cheese; mix lightly."", ""Refrigerate 1 hour.""]",www.kraftrecipes.com/recipes/mediterranean-marinated-vegetable-salad-106422.aspx,Recipes1M,"[""tomatoes"", ""yellow pepper"", ""zucchini"", ""thin red onion"", ""Italian Dressing"", ""fresh basil"", ""garlic"", ""Cheese""]"
1347525,Roasted Autumn Vegetables And Rice ,"[""1 large sweet potato"", ""2 medium carrots"", ""3 small or 1 large turnip"", ""1 medium red onion"", ""2 small or 1 large Granny Smith apple, diced"", ""1 teaspoon cinnamon"", ""1/2 teaspoon ground ginger"", ""1/4 teaspoon freshly ground nutmeg"", ""1/4 teaspoon sea salt"", ""1/4 cup olive oil"", ""1 1/2 cups long grain brown rice"", ""1 cup walnuts"", ""1/2 cup dried cranberries (sweetened with fruit juice, not sugar)"", ""2 scallions, sliced thin""]","[""Preheat oven to 375F."", """", ""Chop up your vegetables and apples, then place in a large bowl and stir in the spices and sea salt. Toss with olive oil until evenly coated, then place onto a baking dish. Roast until tender, about 15-20 minutes."", """", ""While the vegetables cook, prepare the brown rice and walnuts. Place the walnuts onto a baking dish and bake until golden brown. Remove from the oven, let cool then roughly chop."", """", ""Cook the rice in 3 cups of water. Keep warm."", """", ""Once the vegetables are tender, remove from the oven and place in a large bowl. Toss together with the chopped walnuts, scallions, dried cranberries and cooked rice. Taste, adjust seasonings and serve.""]",www.epicurious.com/recipes/member/views/roasted-autumn-vegetables-and-rice-52586141,Gathered,"[""sweet potato"", ""carrots"", ""red onion"", ""apple"", ""cinnamon"", ""ground ginger"", ""freshly ground nutmeg"", ""salt"", ""olive oil"", ""long grain brown rice"", ""walnuts"", ""cranberries"", ""scallions""]"
