Unnamed: 0,title,ingredients,directions,link,source,NER
613253,Pork Chops In Gravy,"[""6-8 med. pork chops"", ""1/2-1 tsp. salt"", ""1/2 tsp. pepper"", ""1 can cream of mushroom soup"", ""1 can water""]","[""Rub pork chops with salt and pepper. Place in heated skillet with tightly fitting lid. Melt enough butter in pan to keep chops from sticking; brown chops quickly. Combine soup and water pour over chops. When mixture returns to boil, reduce heat to very low. Simmer slowly for 1 hour or until chops are tender. Serve with rice or potatoes.""]",www.cookbooks.com/Recipe-Details.aspx?id=68130,Gathered,"[""pork chops"", ""salt"", ""pepper"", ""cream of mushroom soup"", ""water""]"
1705560,Grilled Chili-Rubbed Rib-eyes with Herb Cheese and Asparagus Bundles,"[""4 tablespoons cream cheese, softened"", ""2 tablespoons minced shallots"", ""1 teaspoon fresh lemon juice"", ""2 teaspoons minced fresh chives"", ""2 teaspoons minced fresh basil"", ""1 1/2 tablespoons ancho chili powder"", ""1 tablespoon paprika"", ""1 teaspoon garlic salt"", ""1/2 teaspoon ground red pepper"", ""2 tablespoons olive oil"", ""4 (12-ounce) rib-eye steaks (1 to 1 1/2 inches thick)"", ""1 tablespoon salt"", ""4 1/2 quarts water"", ""20 fresh asparagus spears (about 1/2 pound)"", ""4 slices prosciutto"", ""Garnishes: fresh basil sprigs, lemon wedges""]","[""Stir together first 5 ingredients in a small bowl until blended."", ""Shape into a 4-inch log; wrap in plastic wrap, and chill until firm."", ""Combine chili powder and next 3 ingredients in a small bowl."", ""Stir in olive oil to form a paste."", ""Rub chili mixture on both sides of steaks."", ""Combine salt and 4 1/2 quarts water in a large Dutch oven."", ""Bring water to a boil; add asparagus."", ""Cook 2 minutes or until crisp-tender; drain."", ""Plunge asparagus into ice water to stop the cooking process; drain."", ""Gather 5 asparagus spears into a bundle; wrap with 1 slice of prosciutto."", ""Repeat procedure with remaining asparagus and prosciutto."", ""Set aside."", ""Preheat a gas grill according to manufacturer's instructions."", ""Place steaks on grill rack over direct high heat; grill, covered with grill lid, 10 minutes, turning once."", ""Turn off burners that are directly below steaks."", ""Reduce heat to medium; grill, covered with grill lid, 6 to 8 minutes or until done."", ""Remove steaks to serving plates; top each steak immediately with 1 tablespoon of herb cheese log."", ""Serve asparagus bundles with steaks."", ""Garnish, if desired."", ""\""The recipes for this program, which were provided by contributors and guests who may not be professional chefs, have not been tested in the Food Network's kitchens."", ""They have been tested in the Southern Living Test Kitchens."", ""All brand names have been removed from these recipes, which originally appeared on southernlivingcookoff.com.\""""]",www.foodnetwork.com/recipes/grilled-chili-rubbed-rib-eyes-with-herb-cheese-and-asparagus-bundles-recipe.html,Recipes1M,"[""cream cheese"", ""shallots"", ""lemon juice"", ""fresh chives"", ""fresh basil"", ""ancho chili powder"", ""paprika"", ""garlic salt"", ""ground red pepper"", ""olive oil"", ""salt"", ""water"", ""fresh basil sprigs""]"
1929055,Asian SIZZLING SALADS Pork,"[""1 lb. pork tenderloin, cut into thin strips"", ""1 tsp. oil"", ""1/2 KRAFT SIZZLING SALADS Asian Chicken Dinner Kit"", ""6 cups shredded napa cabbage"", ""1 cup halved snow peas"", ""1 carrot, shredded Target 2 lb For $3.00 thru 02/06"", ""2 green onions, sliced"", ""1/2 cup chow mein noodles""]","[""Cook meat in hot oil in large skillet on medium-high heat 5 to 7 min."", ""or until done, stirring frequently."", ""Add 1/3 cup Teriyaki Ginger Cooking Sauce; cook and stir on low heat 1 min."", ""Combine vegetables with 1/3 cup Toasted Sesame Dressing; top with meat and noodles.""]",www.kraftrecipes.com/recipes/asian-sizzling-salads-pork-133543.aspx,Recipes1M,"[""pork tenderloin"", ""oil"", ""Kit"", ""cabbage"", ""carrot"", ""green onions"", ""noodles""]"
582622,Scottish Shortbread,"[""1 c. fresh butter"", ""2 1/4 c. flour"", ""1/2 c. sugar""]","[""Cream very fresh butter and sugar together."", ""(If butter is not fresh, your shortbread will have a very unpleasant taste)."", ""Batter is very dry and crumbly."", ""Pour into 8 x 8 x 2-inch greased pan. Press dough with the back of a spoon until smooth."", ""Prick with a fork."", ""Bake at 325\u00b0 for 1 hour and 15 minutes."", ""Cut while still warm."", ""Can be frozen."", ""Dough can be sprinkled with granulated sugar or sesame seeds before baking for variety.""]",www.cookbooks.com/Recipe-Details.aspx?id=288579,Gathered,"[""fresh butter"", ""flour"", ""sugar""]"
1977414,Bulk Italian Sausage Recipe,"[""2 1/2 lb Pork shoulder, butt portion, trimmed and cut into large chunks"", ""1/2 Tbsp. Coarse kosher salt"", ""1 Tbsp. Dry anise"", ""1/2 tsp Freshly grnd black pepper"", ""1/8 tsp Cayenne pepper"", ""1/2 tsp Dry oregano"", ""1/2 tsp Dry thyme"", ""2 Tbsp. Water"", ""1/2 lb Prok fat, cut into large chunks"", ""4 x Garlic cloves, peeled""]","[""Put the pork into a large bowl."", ""Add in the salt, anise, peppers, oregano, thyme, and the water."", ""Mix well to coat the meat."", ""Work the seasoned pork, pork fat, and garlic through a meat grinder, using the disc with the largest holes and alternating ingredients as you grind."", ""The Italian Sausage may be stored for up to 5 days in the refrigerator or possibly 6 months in the freezer."", ""YIELD: 3 pounds bulk sausage meat (6 c.) By Sean Coate""]",cookeatshare.com/recipes/bulk-italian-sausage-94992,Recipes1M,"[""Pork shoulder"", ""kosher salt"", ""anise"", ""Freshly grnd black pepper"", ""Cayenne pepper"", ""oregano"", ""thyme"", ""Water"", ""Prok fat"", ""Garlic""]"
717527,Browned Rice,"[""3/4 c. long grain rice"", ""1/4 c. margarine, melted"", ""1 can consomme"", ""1 tsp. garlic salt""]","[""Mix together and bake in a 1-quart casserole at 350\u00b0 for 40 to 45 minutes."", ""Serves 4."", ""(Double recipe to serve more.)""]",www.cookbooks.com/Recipe-Details.aspx?id=637949,Gathered,"[""long grain rice"", ""margarine"", ""consomme"", ""garlic salt""]"
787981,Holiday Shortbread Drops,"[""1 c. butter or margarine"", ""1/2 c. sugar"", ""1 egg yolk"", ""2 tsp. vanilla"", ""1/4 tsp. salt"", ""2 c. flour"", ""1 c. raisins"", ""1 c. chopped walnuts""]","[""Cream butter and sugar."", ""Blend in egg yolk, vanilla and salt. Mix well."", ""Stir in flour."", ""Mix in raisins and walnuts."", ""Drop by small teaspoonfuls onto greased baking sheets."", ""Bake at 400\u00b0 for 10 to 12 minutes or until delicately brown on bottom."", ""Makes about 4 dozen.""]",www.cookbooks.com/Recipe-Details.aspx?id=716931,Gathered,"[""butter"", ""sugar"", ""egg yolk"", ""vanilla"", ""salt"", ""flour"", ""raisins"", ""walnuts""]"
401013,Buttermilk Pie,"[""4 eggs"", ""2 Tbsp. flour"", ""1 tsp. vanilla"", ""3/4 c. buttermilk"", ""2 c. sugar"", ""6 Tbsp. melted butter"", ""1/4 tsp. salt"", ""2 pie shells (shallow)""]","[""Beat eggs."", ""Add sugar, flour, butter, vanilla and salt."", ""Mix thoroughly."", ""Blend in buttermilk."", ""Pour into pastry shells."", ""Bake in a 350\u00b0 oven."", ""Pie should brown.""]",www.cookbooks.com/Recipe-Details.aspx?id=188257,Gathered,"[""eggs"", ""flour"", ""vanilla"", ""buttermilk"", ""sugar"", ""butter"", ""salt"", ""pie shells""]"
1482459,Butterscotch-Pecan Ice Cream Recipe,"[""6 tablespoons (75 g) granulated sugar"", ""3/4 cup (170 g) packed dark brown sugar"", ""4 tablespoons (2 ounces/60g) unsalted or salted butter, cut into pieces"", ""1/2 cup (125 ml) plus 1 1/2 cups (375 ml) heavy cream"", ""3/4 cup (180 ml) half-and-half or whole milk"", ""1/2 teaspoon salt"", ""6 large egg yolks"", ""1 1/2 cups (150 g) pecans, toasted and coarsely chopped""]","[""To make the butterscotch mixture, spread the granulated sugar in an even layer in a medium heavy-bottomed saucepan and cook over medium heat without stirring until the sugar begins to melt around the edges. Using a heatproof utensil, slowly drag the liquified sugar to the center and stir gently until all the sugar is melted. Continue to cook, stirring infrequently, until the caramel turns dark amber in color and begins to foam a bit. Remove from the heat and immediately stir in the brown sugar, butter, the 1/2 cup (125 ml) cream, the half-and-half or milk, and salt. The mixture will steam and bubble up vigorously, then the bubbling will subside."", ""Pour the remaining 11/2 cups (375 ml) cream into a large bowl and set a mesh strainer across the top."", ""In a separate bowl, whisk the egg yolks, then gradually add some of the warm butterscotch mixture, whisking constantly as you pour. Pour the warmed yolks back into the saucepan. Cook over low heat, stirring constantly and scraping the bottom of the pan with a heatproof spatula, until the custard is thick enough to coat the spatula. Pour the custard through the mesh strainer into the cream."", ""Set the bowl containing the custard over a larger bowl of ice water. Stir the custard until cool, then cover and refrigerate until thoroughly chilled."", ""Freeze in an ice cream machine according to the manufacturer's instructions. Stir the pecans into the just-churned ice cream when you remove it from the ice cream machine.""]",www.seriouseats.com/recipes/2011/07/butterscotch-pecan-ice-cream-recipe.html,Gathered,"[""sugar"", ""brown sugar"", ""butter"", ""heavy cream"", ""milk"", ""salt"", ""egg yolks"", ""pecans""]"
1440693,Roasted Sweet Potato Salad,"[""2 pounds sweet potatoes or yams, peeled and cut into 1/2-inch cubes"", ""3/4 cup Hellmann's(R) or Best Foods(R) Canola Cholesterol Free Mayonnaise"", ""1 medium Granny Smith apple, cored and cut into 1/4-inch cubes"", ""1/2 cup dried cranberries""]","[""Preheat oven to 400\u00b0."", ""In medium bowl, toss potatoes with 2 tablespoons Hellmann's(R) or Best Foods(R) Canola Cholesterol Free Mayonnaise. On baking sheet, evenly spread potatoes."", ""Bake, stirring once, 30 minutes or until potatoes are tender; cool completely."", ""In large bowl, combine potatoes, apple, cranberries and remaining Mayonnaise; toss to coat. Chill, if desired."", ""Tip: For an extra special twist, add Sweetened Pecans. In 12-inch nonstick skillet, cook 1 cup chopped pecans with 6 tablespoons sugar, stirring constantly, 5 minutes or until sugar browns. Spread pecan mixture onto greased aluminum foil. Let cool. Break into bite-size pieces, add to salad just before serving."", ""This recipe is an Eat SmartTM recipe. Eat SmartTM recipes can help reduce your intake of saturated fats, trans fats, sugars, sodium and cholesterol."", ""Calories 160, Calories From Fat 50, Saturated Fat 0g, Trans Fat 0g, Total Fat 6g, Cholesterol 0mg, Sodium 160mg, Total Carbohydrate 26g, Sugars 9g, Dietary Fiber 3g, Protein 2g, Vitamin A 260%, Vitamin C 4%, Calcium 2%, Iron 4%""]",www.myrecipes.com/recipe/roasted-sweet-potato-salad,Gathered,"[""sweet potatoes"", ""Foods"", ""apple"", ""cranberries""]"
258098,Spring Surprise Pudding,"[""3 c. rhubarb, cut"", ""1/4 c. water"", ""1 c. sugar"", ""1 c. flour"", ""1 tsp. baking powder"", ""1/4 tsp. salt"", ""1/3 c. shortening"", ""2/3 c. sugar"", ""1 tsp. grated orange rind"", ""1 egg"", ""1/2 tsp. vanilla"", ""2/3 c. milk""]","[""Put"", ""rhubarb"", ""and"", ""water"", ""in"", ""saucepan\tand"", ""cook until tender, about"", ""10"", ""or 15 minutes."", ""Add 1 cup sugar."", ""Simmer 10 minutes"", ""longer."", ""Sift together flour, baking powder and salt. Cream"", ""together"", ""shortening and sugar."", ""Add grated orange rind and egg"", ""and beat until light and fluffy."", ""Add vanilla to milk and add"", ""to"", ""creamed"", ""mixture alternately with flour mixture. Stir until smooth."", ""Pour batter into greased 8 x 8-inch square pan. Pour"", ""bubbling"", ""hot rhubarb sauce over the batter.\tBake at 350\u00b0 for"", ""about\t45"", ""minutes."", ""Serve with whipped topping. Serves 6.""]",www.cookbooks.com/Recipe-Details.aspx?id=488744,Gathered,"[""rhubarb"", ""water"", ""sugar"", ""flour"", ""baking powder"", ""salt"", ""shortening"", ""sugar"", ""orange rind"", ""egg"", ""vanilla"", ""milk""]"
1962571,Rocky Road Ice Cream Cake,"[""Crust"", ""1-1/2 qt. OREO Base Cake"", ""1-1/2 cups dry roasted peanuts, finely chopped Rite Aid Buy 1 Get 1 Free thru 02/06"", ""1 cup unsalted butter, melted"", ""Filling"", ""1-1/2 gal. chocolate ice cream, softened"", ""1-1/2 qt. JET-PUFFED Miniature Marshmallows"", ""2-1/4 qt. OREO Pieces-Medium"", ""Toppings"", ""4-1/2 cups prepared whipped topping"", ""1-1/2 cups dry roasted peanuts, finely chopped Rite Aid Buy 1 Get 1 Free thru 02/06"", ""3/4 cup small chocolate curls""]","[""Crust: Mix all ingredients until well blended."", ""Press 2-1/3 cups (14 oz.)"", ""of the crumb mixture firmly onto bottom of each of 3 (10-inch) springform pans (or 1 springform pan for trial recipe)."", ""Bake in 350F-standard oven 10 min."", ""Cool completely."", ""Filling: Combine ice cream, marshmallows and OREO Pieces."", ""Spoon about 2-1/4 qt."", ""of the ice cream mixture over each crust."", ""Freeze at least 4 hours or overnight until firm."", ""Cut each ice cream cake into 12 slices."", ""For each serving: Spoon 2 Tbsp."", ""of the whipped topping onto each serving; top with 2 tsp."", ""of the peanuts and 1 tsp."", ""of the chocolate curls.""]",www.kraftrecipes.com/recipes/rocky-road-ice-cream-cake-97477.aspx,Recipes1M,"[""Crust"", ""OREO Base Cake"", ""peanuts"", ""unsalted butter"", ""Filling"", ""chocolate ice cream"", ""JET-PUFFED Miniature Marshmallows"", ""OREO Pieces-Medium"", ""Toppings"", ""topping"", ""peanuts"", ""chocolate curls""]"
931285,Impossible Coconut Pie Ii,"[""2 cups milk"", ""1 cup flaked coconut"", ""4 eggs"", ""1 teaspoon vanilla extract"", ""1/2 cup all-purpose flour"", ""6 tablespoons margarine"", ""3/4 cup white sugar"", ""1/4 teaspoon ground nutmeg""]","[""Place milk, coconut, eggs, vanilla, flour, margarine, and sugar in blender. Mix well. Pour into a greased and floured 10 inch pie plate. Sprinkle nutmeg on top."", ""Bake at 350 degrees F (175 degrees C) for 45 minutes.""]",www.allrecipes.com/recipe/12441/impossible-coconut-pie-ii/,Gathered,"[""milk"", ""flaked coconut"", ""eggs"", ""vanilla"", ""all-purpose"", ""margarine"", ""white sugar"", ""ground nutmeg""]"
1717091,Vegan Queso Dip,"[""3 cups plain cashews"", ""6 cups water, divided into 2 3 cups amounts"", ""1 -2 tablespoon bouillon"", ""2 (10 ounce) cans rotel"", ""12 cup nutritional yeast"", ""4 tablespoons lemon juice"", ""1 12 tablespoons cornstarch"", ""1 teaspoon cumin"", ""1 large onion, finely diced"", ""1 tablespoon dry mustard or 2 teaspoons mustard"", ""1 teaspoon bolner pinto bean seasoning (simply add a bit of salt, cayenne, cumin and garlic powder if don't have)"", ""2 tablespoons chopped cilantro"", ""1 teaspoon cayenne pepper (optional)"", ""12 teaspoon turmeric powder (for color) (optional)""]","[""Soak cashews in 3 cups water for at least 2 hours or up to overnight in the fridge."", ""Drain and rinse."", ""In a blender or vitamix, combine cashews, cornstarch and second 3 cups of water."", ""Blend for several minutes until a silky liquid has formed."", ""In a medium pot, combine all ingredients except onions and stir."", ""Bring to a boil and lower to a simmer."", ""Add onions and cook for 5-10 minutes until desired thickness is achieved."", ""Adjust seasonings to your taste, adding more nutritional yeast, mustard, lemon juice, cumin or cayenne pepper as needed."", ""Queso keeps in the fridge very well and does not break apart like traditional cheese sauces.""]",www.food.com/recipe/vegan-queso-dip-518405,Recipes1M,"[""cashews"", ""water"", ""bouillon"", ""nutritional yeast"", ""lemon juice"", ""cornstarch"", ""cumin"", ""onion"", ""mustard"", ""pinto bean seasoning"", ""cilantro"", ""cayenne pepper"", ""turmeric""]"
1201520,Pork Tenderloin Maple And Beer Marinade,"[""1 kg pork tenderloin"", ""1/3 cup maple syrup"", ""1 (335 ml) can beer"", ""1/3 cup whole grain mustard (I like kinds without horseradish... your choice)"", ""1/3 cup chopped onion"", ""1 -2 cloves chopped garlic"", ""1 teaspoon mustard powder"", ""1 teaspoon dried basil""]","[""mix all ingredients together (except pork)."", ""Put pork in a large ziplock bag or bowl and pour marinade over top. refrigerate 6-24 hours."", ""cook as usual.""]",www.food.com/recipe/pork-tenderloin-maple-and-beer-marinade-389018,Gathered,"[""pork tenderloin"", ""maple syrup"", ""beer"", ""whole grain mustard"", ""onion"", ""garlic"", ""mustard powder"", ""basil""]"
770815,Fruit Cake Cookies,"[""1/2 c. butter"", ""1/2 c. brown sugar"", ""2 eggs"", ""1 1/2 c. all-purpose flour (reserve 3/4 c. to coat fruit/nuts)"", ""1 tsp. soda"", ""1/4 tsp. nutmeg"", ""1/4 tsp. cinnamon"", ""1/4 tsp. cloves"", ""1/4 tsp. allspice"", ""1 1/2 tsp. milk"", ""4 tsp. orange juice"", ""1/2 lb. candied cherries"", ""1/2 lb. candied green pineapple"", ""1 lb. dates, cut up"", ""1 lb. pecans (about 4 c.), chopped""]","[""Cream butter and sugar."", ""Add eggs, one at a time, beating after each addition."", ""Add 3/4 cup flour and soda, a little at a time."", ""Combine milk and orange juice and add to flour mixture. Add nuts and fruits which have been coated with the remaining 3/4 cup flour."", ""Drop by teaspoonfuls onto greased baking sheet."", ""Bake at 350\u00b0 for 12 to 15 minutes.""]",www.cookbooks.com/Recipe-Details.aspx?id=694914,Gathered,"[""butter"", ""brown sugar"", ""eggs"", ""flour"", ""soda"", ""nutmeg"", ""cinnamon"", ""cloves"", ""allspice"", ""milk"", ""orange juice"", ""candied cherries"", ""candied green pineapple"", ""dates"", ""pecans""]"
1416313,Shrimp Sullivan'S Island,"[""10 qt. water"", ""2 lemons, cut in half"", ""5 pounds unpeeled, medium-size fresh shrimp"", ""3 medium-size sweet onions, thinly sliced"", ""3 (13.75-oz.) cans quartered artichoke hearts, drained"", ""2 cups olive oil"", ""1 3/4 cups cider vinegar"", ""1 (3.5-oz.) jar capers, undrained"", ""1/4 cup Worcestershire sauce"", ""1 teaspoon salt"", ""1/2 to 1 tsp. hot sauce"", ""Garnish: chopped fresh parsley""]","[""Bring 10 qt. water to a boil in a 12-qt. stockpot over medium-high heat; squeeze lemon halves over water, and add squeezed halves to water in stockpot. Add shrimp, and cook 3 minutes or just until shrimp turn pink. Drain and rinse with cold water to stop the cooking process."", ""Peel shrimp; devein, if desired."", ""Layer shrimp, onions, and artichoke hearts in 2 (13- x 9-inch) baking dishes."", ""Stir together olive oil and next 5 ingredients; pour evenly over shrimp mixture. Cover and chill at least 12 hours or up to 48 hours, stirring occasionally. Garnish, if desired, and serve with a slotted spoon.""]",www.myrecipes.com/recipe/shrimp-sullivans-island,Gathered,"[""water"", ""lemons"", ""shrimp"", ""sweet onions"", ""quartered artichoke hearts"", ""olive oil"", ""cider vinegar"", ""capers"", ""Worcestershire sauce"", ""salt"", ""hot sauce"", ""parsley""]"
230620,Hot Crab Dip,"[""1 lb. jumbo crabmeat, picked"", ""1/2 c. sour cream"", ""1/2 c. mayonnaise"", ""pinch of dry mustard"", ""dash of Worcestershire sauce"", ""dash of Tabasco sauce"", ""2 Tbsp. capers (optional)"", ""1 c. Cheddar cheese, grated""]","[""Heat oven to 350\u00b0."", ""Combine all ingredients, except crab and cheese."", ""Carefully fold in crabmeat."", ""Turn into baking dish sprayed with nonstick cooking spray."", ""Sprinkle on Cheddar."", ""Bake for 20 to 30 minutes, until bubbly on top."", ""Serve with crackers.""]",www.cookbooks.com/Recipe-Details.aspx?id=580584,Gathered,"[""jumbo crabmeat"", ""sour cream"", ""mayonnaise"", ""mustard"", ""Worcestershire sauce"", ""Tabasco sauce"", ""capers"", ""Cheddar cheese""]"
1195009,Princess Roasted Red Pepper Chicken With Creamy Risotto,"[""2 boneless skinless chicken breasts"", ""1/4 cup Kraft roasted red pepper italian parmesan dressing, Divided (Kraft Special Collection)"", ""3/4 cup zucchini, Chopped"", ""1/4 cup carrot, Shredded"", ""1/4 cup red pepper, Chopped"", ""1 cup MINUTE White Rice, Uncooked (or Regular Rice See Description Above)"", ""3/4 cup chicken broth"", ""1/2 cup milk"", ""2 tablespoons Grey Poupon Dijon Mustard (Or Other Brand)""]","[""Heat 1 Tablespoon of the Dressing in saucepan. Add Zucchini, Carrot, and Red Pepper; Cook until crisp-tender, stirring frequently."", ""Stir in Rice, Broth, Milk and Mustard, bring to a boil; Cover; Remove from heat; Let Stand 5 Minutes."", ""Meanwhile, cook Chicken in another skillet in remaining Dressing on medium heat for 8 minutes."", ""Turn Chicken over; Cover; Cook an Additional 10-15 minutes or until Chicken is cooked through.""]",www.food.com/recipe/princess-roasted-red-pepper-chicken-with-creamy-risotto-117653,Gathered,"[""chicken breasts"", ""red pepper"", ""zucchini"", ""carrot"", ""red pepper"", ""White Rice"", ""chicken broth"", ""milk""]"
315655,Beer Stew,"[""2 lb. chuck, cubed"", ""salt and pepper"", ""6 onions, sliced"", ""1 clove garlic"", ""1/4 c. oil"", ""12 oz. beer"", ""bay leaf"", ""1/2 tsp. thyme""]","[""Brown chuck, onions and garlic in oil."", ""Season with salt and pepper."", ""To the beef, add beer, bay leaf and thyme; cook until nice and tender."", ""Serve with whole peeled, boiled potatoes.""]",www.cookbooks.com/Recipe-Details.aspx?id=681964,Gathered,"[""chuck"", ""salt"", ""onions"", ""clove garlic"", ""oil"", ""beer"", ""bay leaf"", ""thyme""]"
745259,Stir-Fry Teriyaki,"[""1 lb. top round steak"", ""1 Tbsp. oil"", ""1 c. frozen broccoli"", ""1 c. green beans"", ""1 red or green pepper"", ""1/3 c. teriyaki sauce""]","[""Partially freeze beef."", ""Cut on bias into thin strips."", ""Add oil to large skillet."", ""Stir-fry vegetables 4 minutes or until crisp-tender."", ""Remove vegetables."", ""Stir-fry 1/2 the beef at a time for 2 to 3 minutes."", ""Return all to skillet and toss with sauce.""]",www.cookbooks.com/Recipe-Details.aspx?id=761280,Gathered,"[""steak"", ""oil"", ""frozen broccoli"", ""green beans"", ""red"", ""teriyaki sauce""]"
1718832,Chicken & Tomato,"[""2 tablespoons extra virgin olive oil"", ""2 lbs chicken breasts, sliced in 1 oz. cubes"", ""1 tablespoon minced garlic"", ""12 cup fresh lime juice"", ""3 tablespoons chopped cilantro"", ""5 medium roma tomatoes"", ""sea salt (to taste)"", ""cayenne pepper (to taste)"", ""basil (to taste)""]","[""Heat saute pan to medium."", ""Add olive oil, garlic, cilantro, and half of the lime juice."", ""Simmer for 4-6 minute While simmering pour the remaining lime juice on the chicken and let stand for 1-2 minute Season chicken with salt and cayenne pepper."", ""After about 4 minutes, add seasoned chicken to pan and cook for 8-10 minutes over medium to high heat."", ""Slice the Romas and put basil on them."", ""When the chicken is almost finished, add the cut up Romas and let cook over medium heat for about 5 more minutes."", ""Serve."", ""It is good alone, but some put it over cooked noodles.""]",www.food.com/recipe/chicken-tomato-358461,Recipes1M,"[""extra virgin olive oil"", ""chicken breasts"", ""garlic"", ""lime juice"", ""cilantro"", ""roma tomatoes"", ""salt"", ""cayenne pepper"", ""basil""]"
324321,Peppery Scalloped Potatoes,"[""1 can cream of mushroom soup, undiluted"", ""1 1/2 c. milk"", ""1/2 to 1 tsp. salt"", ""1/8 tsp. cayenne pepper"", ""5 c. thinly sliced, peeled potatoes"", ""1/4 c. butter or margarine, melted"", ""1/4 c. flour""]","[""In a small bowl, combine the soup, milk, salt and cayenne; set aside. Place a third of the potatoes in a greased 9 X 13 inch pan. Layer with a third of the butter, flour and soup mixture. Repeat layers twice. Bake, uncovered at 350\u00b0 for 1 hour and 20 minutes or until potatoes are tender. Serves 6 to 8.""]",www.cookbooks.com/Recipe-Details.aspx?id=25161,Gathered,"[""cream of mushroom soup"", ""milk"", ""salt"", ""cayenne pepper"", ""potatoes"", ""butter"", ""flour""]"
592990,Mock Pizza,"[""1 (7 oz.) can chopped ripe olives"", ""2/3 c. oil"", ""1/2 tsp. oregano"", ""1/4 tsp. garlic salt"", ""1 lb. mild cheese"", ""2 cans tomato sauce""]","[""Mix together and let set for several hours."", ""Spread on English muffins and bake at 350\u00b0 until bubbly.""]",www.cookbooks.com/Recipe-Details.aspx?id=476553,Gathered,"[""olives"", ""oil"", ""oregano"", ""garlic salt"", ""mild cheese"", ""tomato sauce""]"
801034,Shrimp And Mushroom Stuffing,"[""1 pkg. Stove Top stuffing mix"", ""6 fresh mushrooms"", ""1/2 lb. shrimp, cleaned"", ""2 Tbsp. margarine""]","[""Slice mushrooms and chop shrimp."", ""Saute mushrooms in the 2 tablespoons margarine."", ""Add shrimp and cook until shrimp just turns color."", ""Add a little garlic salt."", ""Mix stuffing according to package directions but omit margarine."", ""Add shrimp/mushroom mixture to stuffing mix."", ""Microwave for 5 minutes.""]",www.cookbooks.com/Recipe-Details.aspx?id=887253,Gathered,"[""Stove Top stuffing mix"", ""mushrooms"", ""shrimp"", ""margarine""]"
974612,Coconut Cookies,"[""1 cup white sugar"", ""1/2 cup brown sugar"", ""1 large egg"", ""1 cup butter"", ""1 1/4 cups flour"", ""1 1/4 cups quick-cooking rolled oats"", ""3/4 cup coconut"", ""1 teaspoon baking powder"", ""1 teaspoon baking soda""]","[""Beat egg, add butter and cream."", ""Add the two sugars and cream well."", ""Add remaining dry ingredients and mix well."", ""Bake at 350\u00b0 for 8-10 minutes.""]",www.food.com/recipe/coconut-cookies-23371,Gathered,"[""white sugar"", ""brown sugar"", ""egg"", ""butter"", ""flour"", ""oats"", ""coconut"", ""baking powder"", ""baking soda""]"
